id,word,phrase,movie
9625,kunna,Om man vill vara med på simlägret måste man kunna simma minst 200 meter.,kunna-05045-fras-1.mp4
9626,vetenskap,Den här boken handlar inte bara om religion utan även om vetenskap. ,vetenskap-05046-fras-1.mp4
9626,vetenskap,Eleven avvek från min lektion utan min vetskap. ,vetenskap-05046-fras-2.mp4
9627,skvallra,Jag har en kompis som älskar skvaller.,skvallra-05047-fras-1.mp4
9627,skvallra,Var du tvungen att sprida det vidare?! Jag litade ju på dig! ,skvallra-05047-fras-2.mp4
9628,längesedan,"Äntligen får vi ses, det var så längesedan sist! ",langesedan-05050-fras-1.mp4
9629,januari,Många av mina vänner fyller år i januari . Då blir det dyrt för mig,januari-05056-fras-1.mp4
9629,januari,Det brukar alltid snöa mycket under januari månad. ,januari-05056-fras-2.mp4
9630,snäll,Om mina barn är snälla får de lördagsgodis.,snall-05061-fras-1.mp4
9630,snäll,Det är många som brukar vara snälla mot mig men jag förstår inte varför.,snall-05061-fras-2.mp4
9630,snäll,Många är alltid snälla mot mig.,snall-05061-fras-3.mp4
9630,snäll,Jag är en snäll pojke.,snall-05061-fras-4.mp4
9632,sambo,Förut var det inte så vanligt med sambor men det är det idag.,sambo-05067-fras-1.mp4
9632,sambo,Nu har min sambo gått iväg för att handla mat.,sambo-05067-fras-2.mp4
9632,sambo,"Det här är Erik, min sambo.",sambo-05067-fras-3.mp4
9632,sambo,Igår sprang jag på hennes sambo.,sambo-05067-fras-4.mp4
9634,har inte gjort,"Jag vill se mig omkring i världen men i Thailand, östra Asien och Indien har jag inte varit.",har-inte-gjort-05071-fras-1.mp4
9634,har inte gjort,Om du aldrig har varit i Hercegovina rekommenderar jag dig att hyra en bil när du är där.,har-inte-gjort-05071-fras-2.mp4
9635,sommar,Förra sommaren var det fruktansvärt hett.,sommar-05072-fras-1.mp4
9635,sommar,Vilka kläder har du på sommaren?,sommar-05072-fras-2.mp4
9638,bäst,Nu när du har skaffat barn är det bäst att du köper en bil.,bast-05079-fras-1.mp4
9639,viska,Det är faktiskt fult att viska.,viska-05080-fras-1.mp4
9639,viska,Det ser ut som om de två viskar till varandra.,viska-05080-fras-2.mp4
9642,lugn,Nu kan jag känna mig lugn för nu har hen kommit hem.,lugn-05086-fras-1.mp4
9642,lugn,"Jag har en orm hemma men den är inte giftig, så det är ingen fara. ",lugn-05086-fras-2.mp4
9645,populär,Öronpiercing är väldigt populärt nu.,popular-05095-fras-1.mp4
9645,populär,Fotboll är en populär sport här i Sverige.,popular-05095-fras-2.mp4
9645,populär,"När jag var yngre, var jag väldigt poppis i skolan.",popular-05095-fras-3.mp4
9645,populär,Jag skulle vilja köpa ett nytt spel. Känner du till något som är populärt?,popular-05095-fras-4.mp4
9648,fjäska,Jag är så trött på att han håller alltid på att försöka ställa in sig hos chefen.,fjaska-05100-fras-1.mp4
9649,presentera,När jag presenterar mig börjar jag alltid med mitt namn och sedan visar jag mitt persontecken.,presentera-05102-fras-1.mp4
9650,få tyst på,Jag har fått tyst på många politiker när jag har föreläst på olika platser i frågor som rör sjukvården.,fa-tyst-pa-05104-fras-1.mp4
9651,gott om,Direktören är väldigt rik.,gott-om-05106-fras-1.mp4
9651,gott om,"Har du gott om tid, så du kan hjälpa mig?",gott-om-05106-fras-2.mp4
9651,gott om,I Norrland är det gott om snö.,gott-om-05106-fras-3.mp4
9651,gott om,Har du gott om semesterdagar kvar?,gott-om-05106-fras-4.mp4
9653,modern,Nu är det modernt med v-ringade tröjor. ,modern-05110-fras-1.mp4
9653,modern,På 70-talet var det modernt med utsvängda byxor. ,modern-05110-fras-2.mp4
9653,modern,"Förut var det modernt med jeans, men det är det inte nu längre. ",modern-05110-fras-3.mp4
9653,modern,Snart ska det komma nya moderna TV-apparater.,modern-05110-fras-4.mp4
9655,vem,Vem har sagt att jag ljuger?,vem-05115-fras-1.mp4
9655,vem,"Den här katten, vems är det?",vem-05115-fras-2.mp4
9656,promiskuös,Min farfar har haft många kvinnor.,promiskuos-05116-fras-1.mp4
9656,promiskuös,Är det han Peter som avverkar kvinnor på löpande band?,promiskuos-05116-fras-2.mp4
9657,färdtjänst,Min kompis som är dövblind får färdtjänst.,fardtjanst-05120-fras-1.mp4
9657,färdtjänst,Synskadade har rätt till färdtjänst.,fardtjanst-05120-fras-2.mp4
9660,expert,Jag förstår inte det här så jag måste fråga en expert.,expert-05124-fras-1.mp4
9660,expert,Om du hittar en väska innehållande en bomb är det bäst att tillkalla expertis.,expert-05124-fras-2.mp4
9664,tänker inte göra,"Alla har olika mål i livet. En del vill skaffa barn, andra inte.",tanker-inte-gora-05135-fras-1.mp4
9664,tänker inte göra,Imorgon ska jag inte jobba.,tanker-inte-gora-05135-fras-2.mp4
9664,tänker inte göra,Iår ska inte min granne som bor ovanför mig resa på semester.,tanker-inte-gora-05135-fras-3.mp4
9665,glad,Jag är väldigt glad över att du har ställt upp som barnvakt.,glad-05136-fras-1.mp4
9665,glad,"Många människor kan ge sken av att vara glada på utsidan,men på insidan är det inte alltid lika glatt. ",glad-05136-fras-2.mp4
9667,pinsam,Idag hände något som var väldigt pinsamt.,pinsam-05138-fras-1.mp4
9667,pinsam,Min syster tycker att allting är pinsamt.,pinsam-05138-fras-2.mp4
9667,pinsam,Många tycker att det är pinsamt att stå med allas ögon riktade mot sig.,pinsam-05138-fras-3.mp4
9667,pinsam,Det är pinsamt om gästerna kommer och jag inte har städat.,pinsam-05138-fras-4.mp4
9672,mamma,Mamma är alltid bäst!,mamma-05150-fras-1.mp4
9672,mamma,Hens mamma är 45 år. ,mamma-05150-fras-2.mp4
9675,få,"När jag fyllde 50 år, så fick jag väldigt många presenter.",fa-05158-fras-1.mp4
9675,få,Hur många poäng fick du på provet du gjorde nyligen?,fa-05158-fras-2.mp4
9676,inspelning,Det här rummet kan användas både för att spela in film och ljud.,inspelning-05159-fras-1.mp4
9676,inspelning,Vi kan först göra inspelningen och sedan lägga på ljudet.,inspelning-05159-fras-2.mp4
9677,oss emellan,"Du har inget med det här att göra, det är en sak mellan oss.",oss-emellan-05162-fras-1.mp4
9677,oss emellan,Om någon kommer fram till oss och vill veta vad vi pratar om svarar jag att det här är en sak mellan oss.,oss-emellan-05162-fras-2.mp4
9681,mästare,Mitt fotbollslag har aldrig blivit svenska mästare i fotboll. ,mastare-05170-fras-1.mp4
9683,är,Om du inte kommer fast du har lovat riskerar du att bli bemött med skepsis.,ar-05173-fras-1.mp4
9688,mitt på dagen,Vi kan träffas kl 10 eller mitt på dagen? ,mitt-pa-dagen-05181-fras-1.mp4
9688,mitt på dagen,Det är oftast mitt på dagen som solen står som högst på himlen. ,mitt-pa-dagen-05181-fras-2.mp4
9689,läsa,Jag brukar läsa tidningen varje dag.,lasa-05183-fras-1.mp4
9689,läsa,Det är viktigt att läsa för att samla på sig mycket kunskap. ,lasa-05183-fras-2.mp4
9691,spegel,Direkt när jag kom in i affären så såg jag en spegel som jag ville ha. ,spegel-05186-fras-1.mp4
9691,spegel,Jag såg mig själv i spegeln och tyckte att jag såg så trött ut så jag satt på lite make-up för att se lite piggare ut. ,spegel-05186-fras-2.mp4
9692,arbetskamrat,Min arbetskamrat bor mitt emot mig.,arbetskamrat-05188-fras-1.mp4
9692,arbetskamrat,Några arbetskamrater jobbar både på skolan och på fritids.,arbetskamrat-05188-fras-2.mp4
9693,bakom,Han svor på att han var ärlig. Men hur det egentligen var vet jag inte.,bakom-05189-fras-1.mp4
9693,bakom,Mobilladdaren är bakom soffan.,bakom-05189-fras-2.mp4
9694,dator,"Min dator börjar bli gammal, jag behöver köpa en ny dator. ",dator-05190-fras-1.mp4
9694,dator,Vilken typ av dator har du? Bärbar eller stationär? ,dator-05190-fras-2.mp4
9700,avstängd,Om man får ett rött kort så innebär det att man är avstängd nästa match.,avstangd-05202-fras-1.mp4
9700,avstängd,En hockeyspelare har blivit avstängd i två år från all former av idrottsligt utövande på grund av att hen tryckte till en domare med klubban. ,avstangd-05202-fras-2.mp4
9701,tidning,Mamma nöjesläste tidningen.,tidning-05203-fras-1.mp4
9707,tolk,I kväll ska jag gå på föräldramöte så jag har beställt tolk.,tolk-05214-fras-1.mp4
9707,tolk,Jag ser inte någon tolk.,tolk-05214-fras-2.mp4
9707,tolk,Jag ser inte tolken.,tolk-05214-fras-3.mp4
9710,tänker inte göra,Jag tänker inte bada imorgon.,tanker-inte-gora-05219-fras-1.mp4
9713,ömtålig,Du måste vara försiktig med glaset för det är ömtåligt och går lätt sönder.,omtalig-05226-fras-1.mp4
9716,teckna,En av de viktigaste delarna av julen är den tecknade filmen som visas kl 15.00 på julafton. ,teckna-05232-fras-1.mp4
9716,teckna,"Min favorittecknade film är en film heter ""Larva"".",teckna-05232-fras-2.mp4
9720,torka,"Jag har tvättat mina kläder, nu hänger kläderna ute på streck och lufttorkar. ",torka-05236-fras-1.mp4
9720,torka,"Mina sockar är blöta, jag måste ta av dem och hänga dem på tork. ",torka-05236-fras-2.mp4
9721,ljus,"Jag älskar ljusa kläder.
Jag tycker verkligen om ljusa kläder.",ljus-05237-fras-1.mp4
9721,ljus,Jag tycker mycket om sommaren eftersom det är ljust ute då. ,ljus-05237-fras-2.mp4
9722,mörk,"Vintern har varit mörk så länge, jag har fått nog av den.",mork-05239-fras-1.mp4
9722,mörk,Jag tycker inte om att sova i mörker eftersom jag är mörkrädd. ,mork-05239-fras-2.mp4
9723,natt,"Jag föredrar nattetid, det innebär att jag är en nattmänniska. ",natt-05241-fras-1.mp4
9723,natt,Var ska du sova imorgon natt? ,natt-05241-fras-2.mp4
9723,natt,Du kan få sova här en natt men inte mer än så.,natt-05241-fras-3.mp4
9728,trygg,Jag känner mig alltid trygg med dig. ,trygg-05249-fras-1.mp4
9728,trygg,Jag känner mig mer trygg med att köra en ny bil än att köra en gammal bil.,trygg-05249-fras-2.mp4
9729,födelsedag,Min födelsedag är den 10:e november. ,fodelsedag-05250-fras-1.mp4
9729,födelsedag,Många av mina vänner fyller år under maj månad. ,fodelsedag-05250-fras-2.mp4
9732,dans,"Jag tycker det är roligt att dansa, jag brukar dansa 2-3 gånger per vecka. ",dans-05254-fras-1.mp4
9732,dans,Att dansa är bra för kroppen eftersom du rör mycket på kroppen när du dansar. ,dans-05254-fras-2.mp4
9735,arbetslös,Det är många döva som går arbetslösa efter studenten.,arbetslos-05289-fras-1.mp4
9735,arbetslös,Hur länge har du varit arbetslös? ,arbetslos-05289-fras-2.mp4
9740,frisk,Jag har varit sjuk i två veckor men nu är jag frisk. ,frisk-05274-fras-1.mp4
9740,frisk,"Du ser inte riktigt frisk ut, är du sjuk? ",frisk-05274-fras-2.mp4
9743,minska,Antal deltagare till den kursen har minskat. ,minska-05278-fras-1.mp4
9743,minska,"Ifjol såldes det mycket bilar, i år har försäljningen minskat. ",minska-05278-fras-2.mp4
9744,plugga,Jag kan inte följa med på bio i kväll för jag måste plugga inför ett prov i morgon.,plugga-05279-fras-1.mp4
9746,kilogram,Min katt som är 6 månader gammal väger 3 kg.,kilogram-05286-fras-1.mp4
9746,kilogram,På gymmet brukar jag lyfta 5 kg men nyligen ökade jag vikten till 7 kg. ,kilogram-05286-fras-2.mp4
9748,väga,Hur mycket väger du?,vaga-05301-fras-1.mp4
9748,väga,"Det finns en cykel som heter Scott, den väger bara 7,7 kg. Cykeln är väldigt dyr, den kostar 66.000 kr. ",vaga-05301-fras-2.mp4
9752,stanna kvar,Hur länge blir du kvar?,stanna-kvar-05295-fras-1.mp4
9752,stanna kvar,Hur länge blir du kvar?,stanna-kvar-05295-fras-2.mp4
9755,hindra,Jag blev stoppad av polisen och den poliskvinna som kom fram till min bil var verkligen snygg! ,hindra-05303-fras-1.mp4
9756,få,Ni får ta hur mycket mat ni vill från det uppdukade bordet.,fa-05306-fras-1.mp4
9756,få,Min dotter frågade mig om hon fick gå till en kompis och det sa jag att hon fick.,fa-05306-fras-2.mp4
9759,få sig en läxa,Nu har jag lärt mig! Jag måste betala tullavgift när jag beställer saker från Kanada.,fa-sig-en-laxa-05316-fras-1.mp4
9759,få sig en läxa,Typiskt mig att packa för mycket! Jag lär mig aldrig att packa lagom!,fa-sig-en-laxa-05316-fras-2.mp4
9759,få sig en läxa,Nu har jag lärt mig! Jag måste låta bli sista skvätten i kaffekannan. För den smakar pyton!,fa-sig-en-laxa-05316-fras-3.mp4
9761,se ut,Jag tycker det ser ut som du är 22 år. Stämmer det?,se-ut-05321-fras-1.mp4
9762,borta,"Nyss såg jag en man som stod en bit bort, jag tittade bort en kort stund och när jag tittade dit  igen så var han försvunnen!

",borta-05322-fras-1.mp4
9762,borta,"Jag och mina tre barn gick in i en affär, och efter två minuter var alla barnen spårlöst borta. ",borta-05322-fras-2.mp4
9763,bedöma något,Jag bedömer att ditt betyg i svenska är A.,bedoma-nagot-05324-fras-1.mp4
9763,bedöma något,Jag bedömer att det är 150 personer med på mötet. ,bedoma-nagot-05324-fras-2.mp4
9764,bli döv,Jag fick just reda på att alla fyra i min sambos familj är födda hörande och att alla med tiden blev döva.,bli-dov-05329-fras-1.mp4
9765,kämpa,I hockey är finländarna kända för att aldrig ge upp.,kampa-05331-fras-1.mp4
9765,kämpa,Min dotter är hemma och pluggar så mycket hon kan för att hon har prov på fredag.,kampa-05331-fras-2.mp4
9767,ta slut,När du har ätit upp får du gå ut.,ta-slut-05336-fras-1.mp4
9770,släcka,När du grillat färdigt så är det viktigt att du ser till att släcka elden. ,slacka-05344-fras-1.mp4
9772,förskräckt,Nyckeln var försvunnen och jag blev helt förskräckt för jag visste inte hur jag skulle komma in.,forskrackt-05346-fras-1.mp4
9772,förskräckt,Under vintersäsongen har lamporna varit tända ofta. När jag fick se elräkningen blev jag helt förskräckt.,forskrackt-05346-fras-2.mp4
9775,förgäves,"Innan det inte fanns mobiltelefoner då var det många som åkte hem till folk för att hälsa på, men när de ringde på så kunde det visa sig att de inte var hemma så då hade de åkt i onödan.",forgaves-05361-fras-1.mp4
9778,överskyla,Varför försöker du dölja ditt misstag?,overskyla-05365-fras-1.mp4
9778,överskyla,Varför försöker du mörka? Du har ju faktiskt gjort fel.,overskyla-05365-fras-2.mp4
9782,föreläsning,Igår när jag hade föreläsning för en stor publik så tyckte jag att jag fick en del konstiga blickar. Det visade sig att jag glömt stänga gylfen. Så pinsamt! ,forelasning-05374-fras-1.mp4
9782,föreläsning,Vill du lyssna på hens föreläsning?,forelasning-05374-fras-2.mp4
9784,snabb,Jag ringde till läkaren för jag ville boka tid och jag fick svar väldigt snabbt.,snabb-05379-fras-1.mp4
9787,överraskad,"På min födelsedag så visade mina optiska signaler att det ringde på dörren och när jag öppnade dörren stod min bror där. Han hade rest hit ända från Brasilien, jag blev så överraskad!",overraskad-05383-fras-1.mp4
9787,överraskad,"Jag blev väldigt förvånad över att en väldig skicklig hockeyspelare inte blivit uttagen till landslaget, kanske beror det på att hen är skadad?",overraskad-05383-fras-2.mp4
9788,vill inte,Jag vill verkligen inte träna! Jag vill bara ligga i soffan och titta på tv.,vill-inte-05384-fras-1.mp4
9788,vill inte,Varför vägrar du leka med oss? ,vill-inte-05384-fras-2.mp4
9790,illa tvungen,Jag har inte städat toaletten på två veckor. Idag är jag så illa tvungen att få det gjort.,illa-tvungen-05390-fras-1.mp4
9791,kommatecken,"I förra veckan köpte jag en ny lägenhet, den kostade 2,5 miljoner. ",kommatecken-05393-fras-1.mp4
9791,kommatecken,"Jag har nyss rättat din svenskatext, du hade glömt ett kommatecken. ",kommatecken-05393-fras-2.mp4
9791,kommatecken,"Jag har nyss rättat din svenskatext, du måste lägga till några fler kommatecken i texten. ",kommatecken-05393-fras-3.mp4
9791,kommatecken,"Jag har kollat igenom din svenskatext, du har för många kommatecken. Du måste ta bort några. ",kommatecken-05393-fras-4.mp4
9795,september,Under september månad finns det mycket svamp.,september-05398-fras-1.mp4
9795,september,"Nyligen, i september månad, köpte jag en ny bil. jag är verkligen nöjd med den",september-05398-fras-2.mp4
9798,stadgar,Alla föreningar har stadgar som man måste följa.,stadgar-05105-fras-1.mp4
9805,känner sig inte bra,Jag känner mig väldigt trött.,kanner-sig-inte-bra-05410-fras-1.mp4
9808,tröja,När jag har tvättat färdigt är jag alltid noga med att sortera tröjor och byxor i olika högar.,troja-05413-fras-1.mp4
9809,varannan,Jag brukar styrketräna varannan vecka.,varannan-05414-fras-1.mp4
9809,varannan,Är det ok att vi pluggar ihop varannan tisdag?,varannan-05414-fras-2.mp4
9813,drag,Sommarstugan är fin men fönstren är otäta och dragiga.,drag-10412-fras-1.mp4
9813,drag,Det drar från de två dörrarna som sitter mitt emot varandra i hallen så därför har jag lagt dit dragstoppare.,drag-10412-fras-2.mp4
9821,två gånger,Min kompis har vunnit på triss tolv gånger medan jag bara har vunnit två.,tva-ganger-05437-fras-1.mp4
9821,två gånger,Jag har sett Björn Skifs vid två tillfällen.,tva-ganger-05437-fras-2.mp4
9822,skjuta upp hela tiden,Jag ska måla färdigt mitt sovrum men skjuter upp det hela tiden.,skjuta-upp-hela-tiden-05438-fras-1.mp4
9822,skjuta upp hela tiden,Varför kommer du aldrig och hälsar på mig?,skjuta-upp-hela-tiden-05438-fras-2.mp4
9822,skjuta upp hela tiden,"Jag tycker inte om personer som inte betalar tillbaka det de är skyldiga, i tid.",skjuta-upp-hela-tiden-05438-fras-3.mp4
9830,brasa,Det är skönt att kunna tända en brasa i sitt hem men det är inget som jag kan göra.,brasa-05449-fras-1.mp4
9839,tredje,Första delen i en film brukar vara bra medan andra och tredje delen brukar vara sämre.,tredje-05468-fras-1.mp4
9839,tredje,Göteborgs Dövas förening vann frågesporten för tredje gången i rad.,tredje-05468-fras-2.mp4
9840,fjärde,Fjärde perioden i NBA:s basketmatcher är alltid spännande.,fjarde-05471-fras-1.mp4
9841,mindre,"Förut drack jag mycket kaffe, nu försöker jag dricka mindre kaffe. ",mindre-05477-fras-1.mp4
9841,mindre,"Jag har mindre läxor än min storasyster, hon har mer läxor än mig. ",mindre-05477-fras-2.mp4
9841,mindre,"Jag har mindre läxor än min syster, hon har mer läxor än mig. ",mindre-05477-fras-3.mp4
9843,sjätte,Nu har skrivaren gått sönder fem gånger om det händer en sjätte gång kommer jag att kassera den.,sjatte-05480-fras-1.mp4
9845,sjunde,Den sjunde James Bond filmen är så bra.,sjunde-05488-fras-1.mp4
9846,åttonde,Just idag är det åttonde gången som du hälsar på mig.,attonde-05489-fras-1.mp4
9846,åttonde,Det är åttonde gången som du glömmer din handduk. Jag är så trött på det.,attonde-05489-fras-2.mp4
9850,buss,Från mitt hem till mitt arbete så måste jag först åka buss för att sedan byta till tunnelbana. ,buss-05499-fras-1.mp4
9850,buss,Det luktade väldigt illa från bussätet bredvid mig. ,buss-05499-fras-2.mp4
9853,spela in,Förut användes VHS-spelare för att spela in filmer. ,spela-in-05504-fras-1.mp4
9854,klockan sex,Rapports sändning klockan sex på kvällen passar mig perfekt för den är textad.,klockan-sex-05505-fras-1.mp4
9854,klockan sex,Kan du komma hem till mig klockan sex ikväll?,klockan-sex-05505-fras-2.mp4
9856,andra plats,Sverige deltog i Världsmästerskapen i simning och jag har för mig att vi kom på andra plats.,andra-plats-05507-fras-1.mp4
9856,andra plats,Jag var med i en golftävling igår och jag kom på andra plats.,andra-plats-05507-fras-2.mp4
9857,tredje plats,Sverige deltog i fotbolls EM i Frankrike och kom på tredje plats.,tredje-plats-05508-fras-1.mp4
9859,femte plats,Resultatet för svenskarna i tennisturneringen blev en femte plats. Det beror på att spelarna drabbades av flera skador.,femte-plats-05511-fras-1.mp4
9862,hela tiden,Han ringer mig hela tiden.,hela-tiden-05520-fras-1.mp4
9862,hela tiden,Skärp dig nu! Sluta svamla hela tiden.,hela-tiden-05520-fras-2.mp4
9866,svarslös,"Jag blev så paff när jag fick veta att hen inte var 60 år som jag trodde utan 85.
",svarslos-05536-fras-1.mp4
9866,svarslös,"Jag visade upp mitt körkort för hen för att bevisa att jag är under 30 år, detta gjorde hen svarslös. ",svarslos-05536-fras-2.mp4
9866,svarslös,"Jag trodde jag hade rätt men så var inte fallet, vilket gjorde att jag kände mig svarslös. ",svarslos-05536-fras-3.mp4
9866,svarslös,Jag argumenterade för min sak för jag var helt säker på att jag hade rätt. Men hen överbevisade mig med sina argument efter det blev jag tyst.,svarslos-05536-fras-4.mp4
9867,potatis,Förut åt man mycket potatis men så är det inte längre för nu kan man välja ris eller pasta istället.,potatis-05539-fras-1.mp4
9867,potatis,På sommaren är jag extra förtjust i färskt potatis.,potatis-05539-fras-2.mp4
9867,potatis,Min familj har odlat potatis i flera generationer.,potatis-05539-fras-3.mp4
9870,klockan sju,Teatern börjar klockan sju.,klockan-sju-05546-fras-1.mp4
9877,lära sig,Jag lärde mig ingenting! ,lara-sig-05564-fras-1.mp4
9880,modig,"Min bror är riktig modig som vågar klättra uppför berget,",modig-05571-fras-1.mp4
9893,bidrag,Idag fick jag ett brev där det stod att jag beviljats bidrag.,bidrag-05593-fras-1.mp4
9898,överföra,Går det bra om jag för över pengarna till ditt konto i morgon ?,overfora-05604-fras-1.mp4
9902,kväll,Imorgon kväll är det fotboll på TV:n.,kvall-05617-fras-1.mp4
9902,kväll,går kväll var jag ute på promenad med hunden i en timme,kvall-05617-fras-2.mp4
9902,kväll,Vill du följa med ut ikväll och äta på restaurang och sedan gå på bio? ,kvall-05617-fras-3.mp4
9903,klockan åtta,Jag och mina kompisar ska på bio ikväll kl 8. Vill du följa med?,klockan-atta-05620-fras-1.mp4
9903,klockan åtta,Porten hemma hos mig brukar låsas kl 8 på kvällen.,klockan-atta-05620-fras-2.mp4
9903,klockan åtta,"Jag har en timer kopplat till min belysning hemma, så lamporna tänds automatiskt kl 8 på kvällen.",klockan-atta-05620-fras-3.mp4
9903,klockan åtta,"Klockan är 8 så snälla, gå och lägg er nu.",klockan-atta-05620-fras-4.mp4
9905,för två veckor sedan,Jag köpte en ny micro för två veckor sedan och allt verkade bra. Men redan efter en vecka gick den sönder vad det nu beror på.,for-tva-veckor-sedan-05623-fras-1.mp4
9906,supa mycket,Under min gymnasietid var det mycket supande och festande minns jag.,supa-mycket-05624-fras-1.mp4
9906,supa mycket,"Min granne verkar supa mycket, det luktar alkohol från hens andedräkt. ",supa-mycket-05624-fras-2.mp4
9911,faster,"Min faster är så snäll för hon bakar alltid bullar och kakor. Men det är lite farligt för man riskerar att gå upp i vikt.
",faster-05631-fras-1.mp4
9912,moster,Hon är min moster. ,moster-05632-fras-1.mp4
9913,polis,Polisyrket verkar riktigt roligt. ,polis-05635-fras-1.mp4
9913,polis,"När jag och min bror var yngre lekte vi ofta ""Tjuv och polis"". ",polis-05635-fras-2.mp4
9920,tre dagar sedan,För tre dagar sedan bytte jag till vinterdäck.,tre-dagar-sedan-05653-fras-1.mp4
9924,byråkrati,"Sverige är verkligen ett byråkratiskt land.
",byrakrati-05661-fras-1.mp4
9927,i ett år,En döv kompis ska åka till USA för att vara på Gallaudet University i ett år.,i-ett-ar-05665-fras-1.mp4
9929,i fyra år,En kompis bor i Göteborg. Hen har bott där i fyra år men jag tror att hen kommer tillbaka snart.,i-fyra-ar-05672-fras-1.mp4
9930,gräma sig,Några grämer sig för att det röda blocket vann valet 2014.,grama-sig-05676-fras-1.mp4
9930,gräma sig,Jag grämde mig verkligen när jag hade lånat flotta pappas bil och råkade skrapa lacken på bilen.,grama-sig-05676-fras-2.mp4
9932,försiktig,Det är väldigt halt ute och jag körde försiktigt för jag ville inte hamna i diket.,forsiktig-05682-fras-1.mp4
9933,spara,Jag brukar spara ungefär 4 000 kronor i månaden.,spara-05687-fras-1.mp4
9933,spara,"Det är onödigt att du kastar bort mat, lägg det i en matlåda istället och ät nästa dag. ",spara-05687-fras-2.mp4
9935,i sex år,Daniel har bott i Solna i sex år.,i-sex-ar-05691-fras-1.mp4
9935,i sex år,Anna har varit anställd hos SDR i sex år.,i-sex-ar-05691-fras-2.mp4
9936,i sju år,Jag har bott här i Stockholm i sammanlagt sju år.,i-sju-ar-05696-fras-1.mp4
9937,i åtta år,Jag och Eva har varit sambo i åtta år.,i-atta-ar-05698-fras-1.mp4
9938,sex kronor,Igår köpte jag tre äpplen och två bananer. Det kostade sex kronor.,sex-kronor-05703-fras-1.mp4
9942,ambassad,Svenska ambassader finns i olika länder runt om i världen. ,ambassad-05730-fras-1.mp4
9942,ambassad,"Om du ska besöka ett land som kräver visum, så måste du besöka det landets ambassad här i Sverige.",ambassad-05730-fras-2.mp4
9942,ambassad,Tysklands ambassad  i Stockholm ligger ute på Djurgården. ,ambassad-05730-fras-3.mp4
9945,samvete,Jag har dålig samvete för jag har knyckt godis,samvete-05737-fras-1.mp4
9945,samvete,Om jag ljuger så får jag ofta dåligt samvete. Därför försöker jag undvika att ljuga. ,samvete-05737-fras-2.mp4
9948,var tredje månad,Jag brukar betala av på billånet var tredje månad.,var-tredje-manad-05966-fras-1.mp4
9949,mars,Mars månad har 31 dagar. ,mars-06006-fras-1.mp4
9949,mars,Vi i familjen funderar på att  åka till fjällen i slutet av mars månad och åka slalom,mars-06006-fras-2.mp4
9950,en timme,Bussen går om en timme.,en-timme-06380-fras-1.mp4
9951,två timmar,"Att flyga till Danmark tar ungefär två timmar.

",tva-timmar-06786-fras-1.mp4
9962,för sex år sedan,"TVn som jag har hemma, en tjock-TV är verkligen gammal. Jag köpte den för sex år sedan.",for-sex-ar-sedan-07241-fras-1.mp4
9964,för sju år sedan,Jag har en vän som kommer från Polen. Hen bor här i Sverige och flyttade hit för sju år sedan.,for-sju-ar-sedan-07244-fras-1.mp4
9964,för sju år sedan,Jag gifte mig för sju år sedan.,for-sju-ar-sedan-07244-fras-2.mp4
