id,word,phrase,movie
4570,inte meningen,Hon sa att det inte var meningen men jag vet inte om jag tror på det. ,inte-meningen-10211-fras-2.mp4
4574,midsommarafton,Jag har många fina minnen från tidigare midsommaraftnar. ,midsommarafton-05068-fras-1.mp4
4574,midsommarafton,Midsommarafton är nästa vecka och jag är verkligen orolig över vad mina barn ska göra då. ,midsommarafton-05068-fras-2.mp4
4577,mista,Jag sökte till Högskolan men jag kom tyvärr inte in.,mista-03715-fras-1.mp4
4578,mobil,"Min mobil är borta, har du sett den?",mobil-05076-fras-1.mp4
4578,mobil,Vad har du för märke på din mobil? ,mobil-05076-fras-2.mp4
4581,moms,"Jag köpte en dator för tio tusen plus moms.
",moms-05082-fras-1.mp4
4591,måla med liten pensel,Jag har gjort små gipstomtar och målat kläder på dem.,mala-med-liten-pensel-05103-fras-1.mp4
4594,november,"I november 2016 var det mycket snö här i Stockholm, 40 cm.",november-05113-fras-1.mp4
4594,november,Jag funderar på att åka på semester till ett varmt land under november månad eftersom det är så mörkt och tråkigt i Sverige då.,november-05113-fras-2.mp4
4595,nu,Varför åker du inte hem nu?,nu-05114-fras-1.mp4
4595,nu,Ska du gå/åka hem nu?,nu-05114-fras-2.mp4
4595,nu,Ska du inte gå/åka hem nu?,nu-05114-fras-3.mp4
4595,nu,"Nu på torsdag är det nationella prov, så du måste du se till att komma hit. ",nu-05114-fras-4.mp4
4596,android,"Vad föredrar du, Andriod eller IOS?",android-09315-fras-1.mp4
4596,android,"Senaste android-versionen har nyss getts ut, så du borde uppdatera din mobil för säkerhets skull.",android-09315-fras-2.mp4
4604,ok,"OK, jag ska göra som du vill.",ok-05131-fras-1.mp4
4605,oktober,Har du tips på resmål som jag kan åka till under oktober månad?,oktober-05132-fras-1.mp4
4605,oktober,När under oktober månad ska du och jag ha vårat möte? ,oktober-05132-fras-2.mp4
4606,om,"Om det kommer 20 personer, då går jag.",om-05133-fras-1.mp4
4606,om,En kompis berättade för mig att hen sett en grön orm inne på toaletten. Om det det hade varit jag så hade jag svimmat! ,om-05133-fras-2.mp4
4608,orange,Hollands fotbollslag  brukar ha oranga tröjor.,orange-05139-fras-1.mp4
4608,orange,Räddningsvästar brukar ha orange färg.,orange-05139-fras-2.mp4
4608,orange,När jag var yngre köpte jag en orange bil som verkligen var ful men det brydde jag mig inte om.,orange-05139-fras-3.mp4
4629,plocka,Tycker du om att plocka bär? ,plocka-05178-fras-1.mp4
4639,publik,Igår tittade jag på en fotbollsmatch och det var inte så mycket publik. Några i publiken satt närmast planen och sedan var det ströplatser här och där. ,publik-05200-fras-1.mp4
4639,publik,De flesta lag brukar vinna när de spelar hemmamatch. Det beror på att de spelar på hemmaplan och har stöd från publiken. ,publik-05200-fras-2.mp4
4640,puh,När jag vaknade på morgonen var min första tanke att jag fått parkeringsböter. Jag rusade ut och blev enormt lättad när jag insåg att jag inte fått några böter.,puh-05201-fras-1.mp4
4640,puh,"Jag hade varit så orolig att mitt hockeylag skulle förlora matchen, vilken lättnad när laget istället vann.",puh-05201-fras-2.mp4
4640,puh,"Jag väntade och väntade på att min dotter skulle komma hem. Först kl 03 kom hon hem, puh! ",puh-05201-fras-3.mp4
4655,sig,Psykiskt sjuka personer behöver hjälp för annars kan de skada sig själva.,sig-05248-fras-1.mp4
4691,jättestor,Min kompis har köpt en båt. Jag föreställde mig att det var en liten en men det var det inte. Det var en bautastor båt.,jattestor-01702-fras-1.mp4
4691,jättestor,När jag hälsade på min kompis första gången visade det sig att han bodde i ett jättestort hus.,jattestor-01702-fras-2.mp4
4691,jättestor,Jag är så spänd inför den stora festen jag ska anordna ikväll!,jattestor-01702-fras-3.mp4
4701,surfa,Om man vill surfa krävs det bra vindar.,surfa-05343-fras-1.mp4
4708,syn,Det finns många olika åsikter om beslutet.,syn-05356-fras-1.mp4
4708,syn,Har du insyn i styrelsens arbete?,syn-05356-fras-2.mp4
4708,syn,Vad har du för syn på beslutet?,syn-05356-fras-3.mp4
4709,synskadad,Min bror är synskadad.,synskadad-05358-fras-1.mp4
4709,synskadad,Vad ska man tänka på om man möter en person som är synskadad?,synskadad-05358-fras-2.mp4
4710,systembolag,Du måste gå till systembolaget och köpa rött vin.,systembolag-05359-fras-1.mp4
4715,t-shirt,De flesta av mina t-shirts är slitna så jag måste köpa nya.,t-shirt-05368-fras-1.mp4
4716,tabbe,Karin har tre barn. De två första var planerade medan det tredje var oplanerat.,tabbe-05369-fras-1.mp4
4716,tabbe,När min mamma blev gravid med mig så var det inte en planerad graviditet men de bestämde sig för att behålla barnet iallafall. ,tabbe-05369-fras-2.mp4
4716,tabbe,"Jag råkade försäga mig, jag skulle ju inte berätta det för någon! ",tabbe-05369-fras-3.mp4
4722,teckenspråk,Under min uppväxt hade jag inte tillgång till teckenspråk men sedan förändrades det och nu är jag fullt teckenspråkig.,teckensprak-05382-fras-1.mp4
4725,Thailand,Jag har varit i Thailand tre gånger.,thailand-05392-fras-1.mp4
4727,tips,Ofta har min mamma bra tips om sådant som jag aldrig har tänkt på.,tips-05395-fras-1.mp4
4727,tips,Har du tips på resmål som jag kan åka till under oktober månad?,tips-05395-fras-2.mp4
4741,turkos,"Teckenspråk har en egen färg, turkos. ",turkos-05426-fras-1.mp4
4741,turkos,Den 14 maj ska alla ha på sig något turkost klädesplagg. ,turkos-05426-fras-2.mp4
4743,tv,"TV utan textremsa, det är fullständigt oacceptabelt!",tv-05428-fras-1.mp4
4745,tvungen,Jag har dubbelbokat mig. Det gäller ett läkarbesök och ett möte men eftersom mötet är viktigt har jag avbokat läkarbesöket.,tvungen-05431-fras-1.mp4
4745,tvungen,Vi var tvungna att avbryta mötet eftersom brandlarmet gick och alla fick lov att ta sig ut.,tvungen-05431-fras-2.mp4
4747,typ,Den där puben är typisk engelsk.,typ-05434-fras-1.mp4
4747,typ,"Hen verkar vara ""typ"" en ordentlig person.
",typ-05434-fras-2.mp4
4752,usb,Min nya laptop har ingen USB-port!,usb-05457-fras-1.mp4
4752,usb,Idag används USB-sticka inte lika mycket eftersom många sparar i molnet istället. ,usb-05457-fras-2.mp4
4773,vet,Jag vet en bättre väg dit. Det blir närmare också.,vet-01862-fras-1.mp4
4773,vet,Vet du var och när vi ska ses?,vet-01862-fras-2.mp4
4773,vet,Vet du att om du köper tre stycken dajm blir det tio kronor för alltihop.,vet-01862-fras-3.mp4
4778,vilka,Vad har du för kläder idag? Vilken färg har dina kläder?,vilka-05496-fras-1.mp4
4781,vintertid,Nu är det vintertid. Då ställer vi tillbaka klockan en timme,vintertid-05501-fras-1.mp4
4786,väder,Vädret verkar bli allt sämre för det regnar ideligen. Det beror säkert på miljöförstöringen.,vader-05513-fras-1.mp4
4786,väder,Idag är det fint väder.,vader-05513-fras-2.mp4
4786,väder,Efter att det hade varit dåligt väder i flera dagar så blev jag så glad över att det äntligen blev fint väder. ,vader-05513-fras-3.mp4
4794,värt,Jag har provat på att köra go-cart. Jag blev påkörd och fick lite ont i nacken men det var det värt. Det var kul!,vart-05526-fras-1.mp4
4801,ärende,Jag måste uträtta några ärenden. Jag kommer klockan tolv.,arende-05537-fras-1.mp4
4801,ärende,Jag kommer lite senare till jobbet idag för jag måste fixa några ärende först.,arende-05537-fras-2.mp4
4815,övertid,Det finns de som måste jobba övertid väldigt ofta medan jag själv aldrig har gjort det.,overtid-05559-fras-1.mp4
4816,skytte,För nöjes skull brukar jag ibland åka till skyttebanan och träna lite skytte. ,skytte-05561-fras-1.mp4
4816,skytte,Min pappa har varit svensk mästare i skytte. ,skytte-05561-fras-2.mp4
4820,applåd,När teaterföreställningen tog slut applåderade alla i publiken.,applad-05569-fras-1.mp4
4822,julafton,Vart ska ni fira julafton? ,julafton-05572-fras-1.mp4
4822,julafton,Under julafton är det alltid någon i familjen som avviker en stund och anledning är att hen ska byta om till tomtekläder. ,julafton-05572-fras-2.mp4
4823,klappa,Du får vara försiktig när du klappar hunden. Den kan bitas.,klappa-05574-fras-1.mp4
4823,klappa,Jag är allergisk mot pälsdjur så jag klappar dem aldrig.,klappa-05574-fras-2.mp4
4823,klappa,Vilken fin hund! Får jag klappa den?,klappa-05574-fras-3.mp4
4825,segelbåt,"I hamnen ligger många segelbåtar förtöjda.
",segelbat-05578-fras-1.mp4
4829,god morgon,Det är viktigt att säga god morgon till sin lärare varje dag för det är artigt.,god-morgon-05590-fras-1.mp4
4829,god morgon,God morgon. Har du sovit bra? ,god-morgon-05590-fras-2.mp4
4829,god morgon,God morgon. Har du sovit gott? ,god-morgon-05590-fras-3.mp4
4832,få se,"Jag vet inte, vi får se.",fa-se-05596-fras-1.mp4
4840,bokhylla,Mitt vardagsrum är helt tomt men jag ska köpa en bokhylla och ställa dit.,bokhylla-05611-fras-1.mp4
4844,ambition,Just idag är min ambitionsnivå inte så hög. Kanske är det vädret som påverkar? ,ambition-05615-fras-1.mp4
4853,lycka till,Lycka till på ditt nya jobb imorgon. ,lycka-till-05633-fras-1.mp4
4853,lycka till,Du tror du kommer att vinna på tipset imorgon? Lycka till med det! ,lycka-till-05633-fras-2.mp4
4854,löjlig,När jag gick på en dramakurs en gång fick vi föreställa apor och hoppa omkring. Jag kände mig löjlig men fick stå ut med övningen ändå.,lojlig-05634-fras-1.mp4
4864,support,Om du har problem med datorn kan du ringa till supporten.,support-05645-fras-1.mp4
4865,förstår inte alls,"Jag fattar absolut ingenting av hur man lägger upp sin ekonomi när det gäller räntor, avbetalning, sparande och utbetalningar. ",forstar-inte-alls-15277-fras-1.mp4
4868,utmana,Jag har aldrig provat på att tapetsera själv men jag vill testa. Det blir en utmaning och jag får se om jag klarar av det eller inte.,utmana-05652-fras-1.mp4
4873,högtalare,"Förut hade jag en högtalare hemma, jag tyckte det såg coolt ut men den användes aldrig. ",hogtalare-05658-fras-1.mp4
4873,högtalare,"Min bror är väldigt intresserade av olika typer av högtalare, själv är jag helt ointresserad av det. ",hogtalare-05658-fras-2.mp4
4879,svara,"Jag fick en svår fråga som jag blev helt ställd av, jag visste inte hur jag skulle svara.",svara-05673-fras-1.mp4
4879,svara,Jag hade ett prov nyss och jag lyckades svara på några av frågorna som var med på provet.,svara-05673-fras-2.mp4
4879,svara,"Jag kan inte svara på det just nu, jag måste få fundera lite först. ",svara-05673-fras-3.mp4
4879,svara,Jag måste svara i bildtelefonen. ,svara-05673-fras-4.mp4
4880,mätt,Jamie Olivers restaurang ”Fifteen” har jag varit på.,matt-05674-fras-1.mp4
4880,mätt,Jag har varit på en känd restaurang.,matt-05674-fras-2.mp4
4880,mätt,Jag har varit på Jamie Olivers restaurang.,matt-05674-fras-3.mp4
4880,mätt,Jag har klarat av två jorden runt-resor.,matt-05674-fras-4.mp4
4881,avundsjuk,Vi lyckades köpa billiga tågbiljetter och då blev min kompis avundsjuk.,avundsjuk-05675-fras-1.mp4
4881,avundsjuk,Jag är avundsjuk på min kompis som har en snygg jacka.,avundsjuk-05675-fras-2.mp4
4881,avundsjuk,Mina föräldrar är på Teneriffa. Det gör mig avundsjuk.,avundsjuk-05675-fras-3.mp4
4883,stor,När jag blir stor vill jag bli brandman.,stor-05680-fras-1.mp4
4883,stor,Vad ska du göra när du blir stor?,stor-05680-fras-2.mp4
4884,handla,Har du inte handlat någon mat idag?,handla-05683-fras-1.mp4
4884,handla,Tycker du om att handla kläder?,handla-05683-fras-2.mp4
4885,värd,Linda har en gammal tavla. Den är värd omkring en halv miljon. Helt otroligt!,vard-05684-fras-1.mp4
4891,länk,Länken till min hemsida är www.skola.se .,lank-15608-fras-1.mp4
4891,länk,Kan du vara snäll och skicka länken till Stockholms Universitet? ,lank-15608-fras-2.mp4
4894,alla hjärtans dag,Snart är det alla hjärtans dag. Ska vi göra något roligt tillsammans då?,alla-hjartans-dag-05695-fras-1.mp4
4894,alla hjärtans dag,"Imorgon är det Alla hjärtans Dag, vad ska ni två göra då? ",alla-hjartans-dag-05695-fras-2.mp4
4895,semester,Den här veckan har jag semester. ,semester-05697-fras-1.mp4
4895,semester,På onsdag startar min två månader långa semester. ,semester-05697-fras-2.mp4
4895,semester,Min pappa är i Japan nu på semester. ,semester-05697-fras-3.mp4
4895,semester,Även under min semester så får jag utbetalt lön. ,semester-05697-fras-4.mp4
4898,samtidig,Jag kan omöjligt lära mig tre språk samtidigt. För då blir jag bara förvirrad.,samtidig-05700-fras-1.mp4
4900,suverän,Min kompis är en hejare på matematik. Jag behöver bara ge honom ett svårt tal så räknar han ut det direkt.,hejare-pa-05705-fras-1.mp4
4900,suverän,Min farfar var en strong gubbe och levde ända tills han blev 105 år gammal.,hejare-pa-05705-fras-2.mp4
4900,suverän,Det finns en person som är super bra på att spela bridge.,hejare-pa-05705-fras-3.mp4
4900,suverän,Min kusin är fenomenal på språk. Hen kan sju olika språk.,hejare-pa-05705-fras-4.mp4
4902,lättad,Det ringde på dörren och jag fasade för att det var någon från Radiotjänst. Men när jag öppnade kunde jag dra en lättnadens suck för det var bara grannen.,lattad-05707-fras-1.mp4
4902,lättad,När jag var ute och gick på stan fick jag se min granne komma emot mig. Snabbt vek jag åt sidan och såg honom/henne passera.Lättad över att slippa mötas gick jag sedan vidare.,lattad-05707-fras-2.mp4
4902,lättad,Jag har ett stort födelsemärke på ryggen. Det kändes obehagligt så för säkerhets skull åkte jag till vårdcentralen och visade upp det. Jag blev lättad när de sa att det var ofarligt.,lattad-05707-fras-3.mp4
4903,jättemycket,När jag var på tivoli köpte jag en lott för skojs skull och till min överraskning vann jag en jättestor nalle.,jattemycket-05708-fras-1.mp4
4903,jättemycket,På zoo finns det en jättestor orm.,jattemycket-05708-fras-2.mp4
4903,jättemycket,Bakom mitt fritidshus reser sig ett jättehögt berg.,jattemycket-05708-fras-3.mp4
4903,jättemycket,När jag var ute på Djurgården så jag många jättestora hus.,jattemycket-05708-fras-4.mp4
4905,munbloss,Jag är ingen riktig rökare. När jag röker drar jag bara munbloss.,munbloss-05710-fras-1.mp4
4915,annandag påsk,Min brorsdotter är född på Annandag påsk,annandag-pask-05723-fras-1.mp4
4915,annandag påsk,Annandag påsk infaller alltid på en måndag. ,annandag-pask-05723-fras-2.mp4
4921,digital,Förut sändes TV:n analogt men nu är det nedlagt och allt sänds numera digitalt.,digital-05734-fras-1.mp4
4922,logoped,Min moster jobbar som logoped.,logoped-05736-fras-1.mp4
4924,adoptivbarn,Min fru och jag har tre barn tillsammans. De två äldsta är biologiska barn och den yngsta har vi adopterat.,adoptivbarn-05741-fras-1.mp4
4936,blottare,En blottare har ett beroende av att visa sig naken och blotta sig för andra.,blottare-05759-fras-1.mp4
4942,bröst,Kvinnor har bröst för att kunna amma.,brost-05765-fras-1.mp4
4953,föda,När jag fick mitt första barn var jag nitton år gammal.,foda-05779-fras-1.mp4
4977,hygien,"Det är viktigt att tänka på hygienen, till exempel att tvätta händerna efter toalettbesök.",hygien-05809-fras-1.mp4
4977,hygien,God hygien innebär mindre risk att sjukdomar sprids.,hygien-05809-fras-2.mp4
4993,jucka,Jag fick syn på en man som stod och juckade med sin fru bakom buskarna.,jucka-05827-fras-1.mp4
4996,kille,Min kille och jag har snart hållit ihop i tio år.,kille-05831-fras-1.mp4
4996,kille,Vi är fem killar och två tjejer. ,kille-05831-fras-2.mp4
4996,kille,Är han din kille? ,kille-05831-fras-3.mp4
5066,samlagsdebut,Min samlagsdebut skedde när jag var 22 år gammal.,samlagsdebut-05923-fras-1.mp4
5066,samlagsdebut,Min samlagsdebut skedde i en hölada.,samlagsdebut-05923-fras-2.mp4
5109,såra,"Förlåt, jag menade inte att såra dig.",sara-05974-fras-1.mp4
5109,såra,Jag vet inte hur jag ska uttrycka mig på rätt sätt så jag inte sårar hen. ,sara-05974-fras-2.mp4
5122,tjej,Jag var hemma när det ringde på dörren. När jag öppnade stod där en söt liten tjej som ville sälja kakor.,tjej-05988-fras-1.mp4
5142,älska,Jag älskar dig.,alska-06012-fras-1.mp4
5148,barn,När jag fick mitt första barn var jag nitton år gammal.,barn-06020-fras-1.mp4
5166,transgender,Personer som är transgender väljer ofta att byta namn. ,transgender-06043-fras-1.mp4
5166,transgender,"Min kompis är transgender, förut var hen en flicka men nu är hen en pojke. ",transgender-06043-fras-2.mp4
5166,transgender,Personer som är transgender finns överallt i världen. ,transgender-06043-fras-3.mp4
5167,deppig,Jag känner mig ofta deppig. ,deppig-06045-fras-1.mp4
5167,deppig,"Vad har hänt, du verkar deppig? ",deppig-06045-fras-2.mp4
5173,kär,Det är härligt att vara kär. ,kar-06051-fras-1.mp4
5173,kär,Det syns att hen är förälskad i hen. ,kar-06051-fras-2.mp4
5209,aids,"Det är bäst att använda kondom för att inte få någon könssjukdom, som till exempel aids.",aids-06091-fras-1.mp4
5211,heterosexuell,På RFSU:s hemsida finns det information om homosexuella och heterosexuella.,heterosexuell-06093-fras-1.mp4
5240,Abrahamsberg,Båda mina barn bor i Abrahamsberg.,abrahamsberg-06130-fras-1.mp4
5429,Karlskoga,Min bästa kompis farmor bor i Karlskoga.,karlskoga-06331-fras-1.mp4
5429,Karlskoga,Själv bor jag i Karlskoga.,karlskoga-06331-fras-2.mp4
5457,Kungsholmen,Jag funderar på att flytta till Kungsholmen för då är det närmare till stan.,kungsholmen-06359-fras-1.mp4
5516,Nacka,"I Nacka har man öppnat ett nytt köpcentrum. Det heter Sickla köpcentrum.
",nacka-06424-fras-1.mp4
5590,Sundbyberg,Jag hittade en lägenhet i Sundbyberg och den ville jag köpa men buden blev för höga så jag struntade i det.,sundbyberg-06501-fras-1.mp4
5600,Södermalm,"Jag bor på Södermalm, nära Gamla Stan.",sodermalm-06511-fras-1.mp4
5600,Södermalm,Ska vi gå och fika på Södermalm?,sodermalm-06511-fras-2.mp4
5600,Södermalm,Någon gång i framtiden skulle jag vilja på Södermalm.,sodermalm-06511-fras-3.mp4
5606,T-centralen,T-centralen är så att säga mötesplatsen för alla tunnelbanelinjer.,t-centralen-06517-fras-1.mp4
5628,Uddevalla,Uddevalla ligger nära Vänersborg.,uddevalla-06543-fras-1.mp4
5707,Örebro,När det gäller tiderna för tåget mellan Stockholm och Örebro så avgår tåget 16.20 från Stockholm och är framme i Örebro 18.30.,orebro-06626-fras-1.mp4
5707,Örebro,"I Örebro finns den enda gymnasieskolan i Sverige för döva och hörselskadade.
I Sverige finns bara en enda gymnasieskola för döva och hörselskadade. Den ligger i Örebro.",orebro-06626-fras-2.mp4
5718,Östersund,Min mamma är född i Östersund. ,ostersund-06640-fras-1.mp4
5718,Östersund,Kung Gustav den tredje bildade staden Östersund år 1786.,ostersund-06640-fras-2.mp4
5722,Abraham,Enligt bibeln hade Abraham en son som hette Isak.,abraham-06644-fras-1.mp4
5723,Abraham,Enligt bibeln hade Abraham en son som hette Isak.,abraham-06645-fras-1.mp4
5734,alla helgons dag,Alla helgons dag firas på den lördagen som infaller mellan den 31 oktober och den 6 november.,alla-helgons-dag-06657-fras-1.mp4
5734,alla helgons dag,Halloween firas en dag innan Alla helgons dag. ,alla-helgons-dag-06657-fras-2.mp4
5735,alla själars dag,Alla Själars Dag firas en dag efter Alla Helgons Dag. ,alla-sjalars-dag-06658-fras-1.mp4
5735,alla själars dag,Alla Själars Dag firas alltid den andra november. ,alla-sjalars-dag-06658-fras-2.mp4
5737,allhelgonadag,Alla helgons dag firas på den lördagen som infaller mellan den 31 oktober och den 6 november,allhelgonadag-06660-fras-1.mp4
5737,allhelgonadag,Halloween firas dagen innan Alla helgons dag. ,allhelgonadag-06660-fras-2.mp4
5777,begrava,För cirka tre år sedan gick jag på fem begravningar under en och samma vecka.,begrava-06705-fras-1.mp4
5777,begrava,Jag minns att jag för tre eller fyra år sedan gick på fem olika begravningar under samma år.,begrava-06705-fras-2.mp4
5777,begrava,Min mamma ligger begravd i Polen.,begrava-06705-fras-3.mp4
5802,bröllop,"Som du vet så ska jag gifta mig framöver, skulle du kunna hjälpa mig att arrangera bröllopet? ",brollop-06741-fras-1.mp4
5802,bröllop,"Min systers bröllop som jag deltog i var så fint ordnat, jag blev så berörd. ",brollop-06741-fras-2.mp4
5860,gud,Jag tror inte att det finns någon Gud men jag tror på den helige Anden.,gud-06828-fras-1.mp4
5930,jul,"Det bästa med julen är den goda maten, presenterna, umgänget med folk samt de tecknade filmerna. ",jul-06912-fras-1.mp4
5930,jul,Det sämsta med julen är all stress. ,jul-06912-fras-2.mp4
5930,jul,När är det jul? ,jul-06912-fras-3.mp4
5976,kristen,Den som är kristen tror på Jesus.,kristen-06961-fras-1.mp4
6093,religion,Jag tycker det är intressant att prata om religion för alla har olika åsikter.,religion-07105-fras-1.mp4
6099,rättfärdig,Jag har aldrig syndat. Jag lever verkligen rättfärdigt.,rattfardig-07114-fras-1.mp4
6180,kilometer,"Du kör sjuttio kilometer. Hur lång tid tar det? En minut, en timme eller tio minuter?",kilometer-07231-fras-1.mp4
6180,kilometer,I morse sprang jag 3 km på löpbandet utan att stanna en enda gång. ,kilometer-07231-fras-2.mp4
6181,kilometer,"Du cyklar en kilometer. Hur lång tid tar det? Tio minuter, tio timmar eller tjugo sekunder?",kilometer-07232-fras-1.mp4
6181,kilometer,Idag sprang jag 3 km på löpbandet utan att stanna. ,kilometer-07232-fras-2.mp4
6181,kilometer,Avståndet Stockholm - Trosa är ungefär 34 km. ,kilometer-07232-fras-3.mp4
6182,maraton,Jag brukar springa Stockholms maraton varje år. En skada har gjort att jag har stått över i tre år men nu ska jag vara med igen.,maraton-01926-fras-1.mp4
6198,grop,När jag var ute och gick på vägen såg jag en stor grop som jag fick lov att väja för.,grop-07285-fras-1.mp4
6201,klippa av,Gå och klipp håret! ,klippa-av-07289-fras-1.mp4
6216,stig,Jag tycker att det är lite läskigt att gå på små stigar för det kan ju dyka upp en orm som gör mig vettskrämd.,stig-07312-fras-1.mp4
6216,stig,Jag går på en stig varenda dag när jag går till bussen.,stig-07312-fras-2.mp4
6220,sänka,När det snöar kraftigt är det bäst att köra försiktigt. Även om hastighetsskylten visar 110 är det säkrast att sänka farten.,sanka-07316-fras-1.mp4
6226,få,Det är inte många som har varit på månen.,fa-07345-fras-1.mp4
6226,få,Varför är det så få personer här? Jag som trodde att vi skulle bli många.,fa-07345-fras-2.mp4
6242,snögubbe,Vill du hjälpa mig att bygga en stor snögubbe?,snogubbe-07445-fras-1.mp4
6247,klubba,När jag köper godis så brukar jag köpa en påse godis och två klubbor. ,klubba-07481-fras-1.mp4
6247,klubba,Det brukar finnas ett ställ med klubbor intill kassan där du beställer pizza. ,klubba-07481-fras-2.mp4
6260,har inte,"Jag har inget hem, jag brukar sova hos vänner.",har-inte-07516-fras-1.mp4
6263,tillbaka,Hen har lånat en penna som ska lämnas tillbaka.,tillbaka-07538-fras-1.mp4
6275,squash,Squash är en tuff sport. Trots att banan är liten blir man helt slut.,squash-07627-fras-1.mp4
6279,forward,Min kompis är verkligen en skicklig forward i fotboll.,forward-07642-fras-1.mp4
6279,forward,När jag var yngre så var jag fotbollsmålvakt men sedan när jag blev äldre så bytte jag position och började spela som forward istället.,forward-07642-fras-2.mp4
6281,anfall,Jag började spela innebandy som back men numera är jag anfallsspelare för det är roligare att gå till anfall.,anfall-07671-fras-1.mp4
6281,anfall,Det finns ett fotbollslag i England som har ett vasst anfallsspel med snabba passningar och många mål. ,anfall-07671-fras-2.mp4
6286,mittfält,I fotboll är det mittfältarna som till stor del styr spelet. De fördelar passningar och hjälper till i försvaret.,mittfalt-07716-fras-1.mp4
6287,mål,"Det står 1-0 i matchen jag tittar på nu. Efter en stund står det 2-0. Två noll målet var ett ""skitmål"".",mal-02049-fras-1.mp4
6294,smartboard,En del föredrar att använda en smart board medans en del föredrar den äldre tekniken med en white board. ,smartboard-07745-fras-1.mp4
6294,smartboard,En smartboard är verkligen smidig att använda eftersom du både kan titta på film samt göra anteckningar och spara ner dessa i smartboarden.,smartboard-07745-fras-2.mp4
6294,smartboard,Jag avskyr att använda en smartboard eftersom jag inte vet hur man gör.,smartboard-07745-fras-3.mp4
6294,smartboard,En smartboard är alltid vit. ,smartboard-07745-fras-4.mp4
6302,inspelning,"Den här månaden ska jag jobba med manus, efter det blir det inspelning. ",inspelning-07770-fras-1.mp4
6302,inspelning,"Sista tre månaderna har jag enbart arbetat med inspelning, framöver ska jag nu jobba med redigering.  ",inspelning-07770-fras-2.mp4
6305,ta med,Jag glömde helt bort att ta med mig min mobil två gånger förra veckan.,ta-med-07789-fras-1.mp4
6305,ta med,Varför tog du inte med nyckeln hemifrån?,ta-med-07789-fras-2.mp4
6309,spela,Hen kan inte spela fotboll ikväll. ,spela-01723-fras-1.mp4
6311,75:a,"Min kompis ville bjuda på sprit, så hen satte fram en 75:a.",75a-07810-fras-1.mp4
6312,varm korv,Vill du ha en varm korv eller hamburgare?,varm-korv-07811-fras-1.mp4
6312,varm korv,När jag kollar på hockey så köper jag alltid en varm korv under pausen.,varm-korv-07811-fras-2.mp4
6322,innebandy,"Jag har spelat innebandy, ungefär hundra matcher utan att bli utvisad en enda gång.",innebandy-07858-fras-1.mp4
6332,långt,Jag har gått väldigt långt idag.,langt-07525-fras-1.mp4
6332,långt,Jag trodde att jag snart skulle vara framme men så fick jag syn på en vägskylt och insåg att det var mycket längre kvar att köra än jag trodde.,langt-07525-fras-2.mp4
