id,word,phrase,movie
1643,många,Är det många som kommer?,manga-01061-fras-3.mp4
1644,hur många,Hur många kommer?,hur-manga-01062-fras-1.mp4
1644,hur många,Hur många dagar semester har du i år? ,hur-manga-01062-fras-2.mp4
1645,handlingsförlamad,Min datormus har gått sönder. Hur ska jag nu kunna jobba?,handlingsforlamad-01063-fras-1.mp4
1645,handlingsförlamad,Mina två kompisar är osams med varandra hela tiden. Jag har försökt hjälpa dem att lösa konflikten men det är helt omöjligt.,handlingsforlamad-01063-fras-2.mp4
1645,handlingsförlamad,Mina två kompisar är osams med varandra hela tiden. Jag har verkligen ingen aning om hur jag skulle kunna hjälpa dem att lösa konflikten.,handlingsforlamad-01063-fras-3.mp4
1647,paralyserad,"Jag gick in i det läskiga huset som var alldeles snett och vint. När jag gått några steg där inne, dök det plötsligt upp ett spöke framför mig och jag blev helt paralyserad.",paralyserad-01065-fras-1.mp4
1647,paralyserad,Varför blev du helt ställd när du fick syn på mig igår?,paralyserad-01065-fras-2.mp4
1648,tafatt,Min dator havererade igår. Jag blev helt ställd och vet inte hur jag ska lösa det.,tafatt-01066-fras-1.mp4
1653,nervös,Är du nervös?,nervos-01072-fras-1.mp4
1653,nervös,Jag känner mig nervös inför tentan imorgon. ,nervos-01072-fras-2.mp4
1654,demonstrera,Den 14:e maj ska det bli en demonstration.,demonstrera-01073-fras-1.mp4
1655,invandrare,Med invandrare menar man en person som inte är född här i Sverige.,invandrare-01074-fras-1.mp4
1655,invandrare,Det finns en stad som tar emot väldigt många invandrare.,invandrare-01074-fras-2.mp4
1655,invandrare,Många döva invandrare kommer till Västanviks folkhögskola.,invandrare-01074-fras-3.mp4
1656,marschera,Varje år firas teckenspråket med en parad den 14 maj.,marschera-01075-fras-1.mp4
1656,marschera,Har du gått med i ett demonstrationståg någon gång?,marschera-01075-fras-2.mp4
1656,marschera,Har du gått med i ett demonstrationståg någon gång?,marschera-01075-fras-3.mp4
1659,äldre,Det är intressant att följa statistiken som visar att allt fler äldre börjar studera på universitet.,aldre-01078-fras-1.mp4
1659,äldre,Jag märker att jag blir fortare trött nuförtiden. Det är nog för att jag har blivit äldre.,aldre-01078-fras-2.mp4
1659,äldre,Min syster är äldre än jag.,aldre-01078-fras-3.mp4
1660,blyg,Det finns en flicka som heter Camilla och hennes persontecken är detsamma som tecknet för blyg eftersom hon alltid är blyg.,blyg-01079-fras-1.mp4
1660,blyg,När jag var liten var jag blyg men det är jag inte numera.,blyg-01079-fras-2.mp4
1660,blyg,Min bror är så blyg.,blyg-01079-fras-3.mp4
1660,blyg,Det syns på dig att du är blyg.,blyg-01079-fras-4.mp4
1662,skam,Känner du att du bär på skam? ,skam-01081-fras-1.mp4
1662,skam,Min kompis känner aldrig skam om hen gör något olämpligt eller olagligt.,skam-01081-fras-2.mp4
1663,huvudvärk,Om jag inte har druckit kaffe före klockan 12 så får jag alltid huvudvärk. Typiskt mig!,huvudvark-01083-fras-1.mp4
1664,älg,"Förra veckan när jag var ute och körde, klev en älg oförhappandes ut på vägen. Vi krockade och bilen blev helt demolerad.",alg-01084-fras-1.mp4
1668,god,"När jag var i Nepal, besökte jag en bergsby. Människorna som bodde där var väldigt vänliga.",god-01089-fras-1.mp4
1668,god,Tycker du att australiensarna är ett vänligt folk?,god-01089-fras-2.mp4
1674,föreställa sig,"Tänk dig att du är ute bara en timme per dag, hur skulle du må då?",forestalla-sig-01096-fras-1.mp4
1674,föreställa sig,"Föreställ dig att du inte skulle ha en mobiltelefon, hur skulle du klara det?",forestalla-sig-01096-fras-2.mp4
1674,föreställa sig,"Om du tänker dig att du är 25 år gammal, vad skulle du syssla med då?",forestalla-sig-01096-fras-3.mp4
1674,föreställa sig,"Ponera att det är konflikter på din arbetsplats, hur skulle du lösa det ?",forestalla-sig-01096-fras-4.mp4
1675,saga,Varje kväll brukar jag berätta sagor för min syster.,saga-01097-fras-1.mp4
1676,rosa,Min kompis har en rosa mobil.,rosa-01098-fras-1.mp4
1676,rosa,Jag tycker att färgen är för rosa. Jag vill ha mer rött.,rosa-01098-fras-2.mp4
1678,spara,"Det är onödigt att kasta bort mat, du kan spara den i en matlåda som du kan äta nästa dag.  ",spara-01101-fras-1.mp4
1678,spara,"Det är bättre att ta tunnelbanan till jobbet istället för att ta bilen, det sparar du pengar på.",spara-01101-fras-2.mp4
1681,dam,När man går in på H&M så ligger oftast damavdelningen till vänster och herravdelningen till höger.,dam-01104-fras-1.mp4
1681,dam,Middagen är enbart för damer.,dam-01104-fras-2.mp4
1681,dam,Jag fick en väska i julklapp en typisk damväska.,dam-01104-fras-3.mp4
1682,kvinna,Man brukar säga att när en tjej har fyllt 30 har hon blivit kvinna.,kvinna-01106-fras-1.mp4
1685,inom en snar framtid,Framöver tänker jag köpa en ny tv. ,inom-kort-01109-fras-1.mp4
1685,inom en snar framtid,Framöver ska jag boka en resa. ,inom-kort-01109-fras-2.mp4
1685,inom en snar framtid,Min bil har gått sönder. Kan du laga den framöver? ,inom-kort-01109-fras-3.mp4
1686,om ett tag,Jag tänkte teckna medlemskap på ett gym framöver och börja träna.,om-ett-tag-00313-fras-1.mp4
1686,om ett tag,När är det du åker till Österrike? Är det snart eller ligger det längre fram i tiden?,om-ett-tag-00313-fras-2.mp4
1687,så småningom,Jag tänkte boka en golfresa snart.,sa-smaningom-01112-fras-1.mp4
1687,så småningom,Tänkte du bli medlem ganska snart eller dröjer det?,sa-smaningom-01112-fras-2.mp4
1688,längre fram,"Jag vet inte när vi kommer att träffas igen, det kanske dröjer ett bra tag.",langre-fram-01113-fras-1.mp4
1689,hög,Igår kväll blev jag fundersam när golvet började vibrera. Det visade sig att grannen ovanför spelade hög musik.,hog-01114-fras-1.mp4
1690,lång,Alla i min familj är långa. Det är bara jag som är kort.,lang-01115-fras-1.mp4
1690,lång,Alla basketspelare är långa.,lang-01115-fras-2.mp4
1690,lång,"Hur lång är en flicka som är 15 år? 15 cm, 150 cm eller 15 meter? ",lang-01115-fras-3.mp4
1691,stor,Min systers barn har verkligen blivit stora. Jag har inte sett dem på länge.,stor-01116-fras-1.mp4
1691,stor,När jag blir stor vill jag bli brandman.,stor-01116-fras-2.mp4
1691,stor,Min son är stor nu.,stor-01116-fras-3.mp4
1692,mer,Jag känner mig tveksam till att binda räntan nu. Jag ser hellre att den går ner ännu mer innan jag binder den.,mer-01117-fras-1.mp4
1694,underlägsen,Tror du att han känner sig nedvärderad?,underlagsen-01123-fras-1.mp4
1694,underlägsen,"Det finns en person som alltid ser ner på mig som att jag är mindre värd, det är inte bra! ",underlagsen-01123-fras-2.mp4
1695,våning,Förut bodde jag på åttonde våningen. Nu har jag flyttat ner på andra våningen och bor i en mindre lägenhet.,vaning-01124-fras-1.mp4
1697,påminna,Jag har påmint hen flera gånger men det verkar ändå som att hen har glömt bort det.,paminna-01127-fras-1.mp4
1697,påminna,Jag har påmint honom flera gånger men det verkar som att han har glömt bort det.,paminna-01127-fras-2.mp4
1697,påminna,Har du påmint henne om morgondagens möte?,paminna-01127-fras-3.mp4
1698,påkalla uppmärksamhet,Jag sa till vakten att det hade uppstått bråk utanför.,pakalla-uppmarksamhet-01806-fras-1.mp4
1698,påkalla uppmärksamhet,Du måste säga till hen! ,pakalla-uppmarksamhet-01806-fras-2.mp4
1698,påkalla uppmärksamhet,Har du pratat med hennes föräldrar om att hon har har varit borta mycket?,pakalla-uppmarksamhet-01806-fras-3.mp4
1698,påkalla uppmärksamhet,Har du informerat hennes föräldrar om att hon har varit borta mycket från skolan?,pakalla-uppmarksamhet-01806-fras-4.mp4
1699,otrogen,Varför är man otrogen? Det kan man undra men det finns alltid någon orsak till det.,otrogen-01130-fras-1.mp4
1701,bulle,Vill du ha en bulle?,bulle-01133-fras-1.mp4
1702,fond,Om du vill resa till Gallaudet kan du söka fondpengar.,fond-01134-fras-1.mp4
1702,fond,De flesta av mina fonder har sjunkit i värde. ,fond-01134-fras-2.mp4
1703,portion,Min pappa äter alltid stora portioner.,portion-01135-fras-1.mp4
1705,semla,Förut åt man semlor bara i februari till skillnad från nu då man äter dem redan från december till april.,semla-01137-fras-1.mp4
1709,anmäla,Om du blir bestulen på dina saker är det viktigt att anmäla det till polisen.,anmala-01141-fras-1.mp4
1710,budskap,"Människor som är konstintresserade är ofta duktiga på att uppfatta budskapet i en tavla.
",budskap-01142-fras-1.mp4
1710,budskap,En blogg är ett bra redskap om du vill nå ut med ett budskap. ,budskap-01142-fras-2.mp4
1711,meddela,Jag är sjuk så jag måste meddela skolan att jag inte kommer.,meddela-01143-fras-1.mp4
1711,meddela,Kan du meddela honom/henne att hen måste sticka nu.,meddela-01143-fras-2.mp4
1711,meddela,Jag måste tala om att jag inte kommer på lördag.,meddela-01143-fras-3.mp4
1711,meddela,Du har inte sagt något till mig.,meddela-01143-fras-4.mp4
1712,förvarna,"Bara så du vet är hen en känslig person.
Jag vill att du ska veta att hen är en känslig person.",forvarna-01144-fras-1.mp4
1712,förvarna,Varför sa du inte till mig? Nu blev det ju helt fel och det blev jättepinsamt!,forvarna-01144-fras-2.mp4
1712,förvarna,Men varför sa du inte till mig?!,forvarna-01144-fras-3.mp4
1713,påminna,Har du påmint alla att de ska ta med regnkläder?,paminna-01145-fras-1.mp4
1713,påminna,Har du påmint dem att ta med fickpengar?,paminna-01145-fras-2.mp4
1714,störa,Barnet sover där inne och jag vill inte störa.,stora-01147-fras-1.mp4
1715,väcka,Jag funderar på att sova en liten stund. Kan du väcka mig om en halvtimme?,vacka-01148-fras-1.mp4
1715,väcka,Du får inte väcka mig!,vacka-01148-fras-2.mp4
1718,mindre,Jag måste börja äta mindre för undvika att gå upp i vikt. ,mindre-01151-fras-1.mp4
1718,mindre,Tidigare var det alltid många som kom. Nu blir det allt färre så vi kanske får sluta med träningarna.,mindre-01151-fras-2.mp4
1732,program,Nu på lördag firar Manillaskolan 200-årsjubileum. Jag vet inte hur programmet ser ut men jag ska ta reda på det.,program-01168-fras-1.mp4
1734,skrapa,Om man har fått missfall bör man åka till sjukhuset. För det kan hända att det finns rester kvar i livmodern så att man behöver skrapas.,skrapa-01172-fras-1.mp4
1735,bakom,Många tror att de känner mig men vem jag är innerst inne vet de inte.,bakom-01174-fras-1.mp4
1739,ute,Förra veckan var det riktigt kallt ute.,ute-01180-fras-1.mp4
1741,gymnastik,Gymnastik i skolan är viktigt med tanke på att barnen ska orka sitta still hela dagarna.,gymnastik-01183-fras-1.mp4
1746,reserverad,På mötet finns det en person som alltid är tyst och reserverad.,reserverad-01188-fras-1.mp4
1746,reserverad,Min kompis är alltid reserverad när han träffar nytt folk men sen efter ett tag släpper det.,reserverad-01188-fras-2.mp4
1747,skilja,Det är likadana bilar som står bredvid varandra. Det enda som skiljer dem åt är färgen.,skilja-11464-fras-1.mp4
1751,back,När jag spelar fotboll är jag back.,back-01195-fras-1.mp4
1752,hela dagen,I går regnade det hela dagen. Trist!,hela-dagen-01196-fras-1.mp4
1752,hela dagen,"Om du inte har ätit på hela dagen, finns det risk för att du blir yr för att du inte fått i dig tillräckligt med energi.",hela-dagen-01196-fras-2.mp4
1752,hela dagen,Gårdagens föreläsning pågick hela dagen.,hela-dagen-01196-fras-3.mp4
1752,hela dagen,De låg hela dagen och solade. ,hela-dagen-01196-fras-4.mp4
1754,skål,Jag har köpt en fin blå skål.,skal-01200-fras-1.mp4
1757,fond,"Om du tänker starta ett projekt, försök då att söka pengar ur någon fond.",fond-01203-fras-1.mp4
1759,boll,Det finns bollar i många olika storlekar.,boll-01205-fras-1.mp4
1759,boll,Bästa julklappen i år är boll.,boll-01205-fras-2.mp4
1759,boll,Ungarna föredrar att leka med bollen.,boll-01205-fras-3.mp4
1761,värld,Jag jobbar jämt för att få ihop en massa pengar till en jordenruntresa.,varld-01210-fras-1.mp4
1762,sömnig,Jag var på bio igår. Men jag var för trött så efter ett tag gick jag därifrån.,somnig-01211-fras-1.mp4
1762,sömnig,Du verkar trött idag! När gick du och lade dig igår?,somnig-01211-fras-2.mp4
1762,sömnig,Du verkar trött idag! När gick du och lade du dig igår?,somnig-01211-fras-3.mp4
1763,pigg,Min son är alltid pigg på morgon.,pigg-01212-fras-1.mp4
1763,pigg,Om jag dricker fem koppar kaffe så blir jag väldigt pigg. ,pigg-01212-fras-2.mp4
1763,pigg,Min pappa var alltid pigg förut men nu när han har blivit äldre har han blivit mer trött.,pigg-01212-fras-3.mp4
1764,åker,Det hände i Holland en gång att ett flygplan av misstag landade på en åker istället för att landa på flyglatsen.,aker-01215-fras-1.mp4
1765,äng,"Det finns olika typer av ängar. De kan vara torra, medelfuktiga eller fuktiga.",ang-01216-fras-1.mp4
1766,liter,Hur mycket rymmer en kastrull? 1. 3 liter. 2. 30 liter. 3. 3 deciliter.,liter-01217-fras-1.mp4
1766,liter,Hur mycket rymmer en hink? 1. 3 liter. 2. 30 liter. 3. 100 deciliter.,liter-01217-fras-2.mp4
1766,liter,"Hur mycket rymmer ett badkar? 1. 30 deciliter. 2. 3 liter. 3. 300 liter.
",liter-01217-fras-3.mp4
1766,liter,Jag rekommenderar att du dricker minst en liter vatten varje dag. Då kommer du att må toppen.,liter-01217-fras-4.mp4
1767,höja,Regeringen har beslutat att höja skatten inom kort.,hoja-01218-fras-1.mp4
1767,höja,Jag läste i tidningen imorse att bensinpriset ska höjas med tio öre imorgon.,hoja-01218-fras-2.mp4
1767,höja,"Om ett hus är skadat och i dåligt skick så är det bra att renovera och återställa huset i bra skick, då höjs husets värde markant.",hoja-01218-fras-3.mp4
1770,stiga i pris,Hyreskostnaden har skjutit i höjden.,stiga-i-pris-01221-fras-1.mp4
1770,stiga i pris,Hur kommer det sig att en biobiljett är så mycket dyrare nu?,stiga-i-pris-01221-fras-2.mp4
1770,stiga i pris,Fram tills idag har hyreskostnaderna stigit kraftigt.,stiga-i-pris-01221-fras-3.mp4
1774,somna,I går kväll somnade jag redan klockan åtta.,somna-01226-fras-1.mp4
1776,försova sig,På min första arbetsdag försov jag mig. Pinsamt!,forsova-sig-01228-fras-1.mp4
1785,svarslös,"Jag trodde aldrig flickan skulle komma till min fest, men det gjorde hon. Där fick jag så jag teg. ",svarslos-01238-fras-1.mp4
1785,svarslös,Erkänn att du blev svarslös när jag bevisade för dig att jag hade rätt. ,svarslos-01238-fras-2.mp4
1787,anka,Om du vill få god smak på din anka så är rekommendationen att du har den i ugnen under lång tid på låg temperatur. ,anka-01240-fras-1.mp4
1787,anka,Vilka kryddor passar bäst till anka i ugn? ,anka-01240-fras-2.mp4
1790,patient,"Det är viktigt att läkaren och patienten har en bra relation.
Det är viktigt att det är en bra relation mellan läkare och patient.",patient-01244-fras-1.mp4
1793,böter,Du måste ställa in parkeringsskivan för att undvika böter.,boter-01251-fras-1.mp4
1793,böter,Jag fick böter för att jag körde 100 km/tim på en 80 väg,boter-01251-fras-2.mp4
1793,böter,Varför ska jag bli bötfälld? Jag parkerade bara fem minuter.,boter-01251-fras-3.mp4
1793,böter,Jag har inga böter som behöver betalas. ,boter-01251-fras-4.mp4
1796,klämma åt någon,Jag skulle verkligen vilja nita den där parkeringsvakten som gav mig en p-bot! ,klamma-at-nagon-01254-fras-1.mp4
1796,klämma åt någon,Jag ska allt slå dig i det här tv-spelet!,klamma-at-nagon-01254-fras-2.mp4
1799,kurs,När slutar kursen? ,kurs-01259-fras-1.mp4
1805,mat,"Vi måste handla mat, vi ska ju ha fest på lördag.",mat-01266-fras-1.mp4
1805,mat,Vilken mat gillar du bäst?,mat-01266-fras-2.mp4
1806,äta,"Igår kväll efter mitt hårda träningspass mådde jag inte alls bra, det beror på att jag inte hade ätit och druckit ordentligt innan träningen. ",ata-01267-fras-1.mp4
1807,servett,Jag har köpt ljus och servetter i matchande färg.,servett-01268-fras-1.mp4
1813,myndig,Min dotter blir snart myndig.,myndig-01274-fras-1.mp4
1819,pengar,Jag har gott om pengar. ,pengar-01282-fras-1.mp4
1819,pengar,"Pengar är inte allt, det finns vissa saker som du inte kan köpa för pengar. ",pengar-01282-fras-2.mp4
1819,pengar,Har du inga pengar? ,pengar-01282-fras-3.mp4
1819,pengar,"Vad är viktigast, pengar eller kärlek? ",pengar-01282-fras-4.mp4
1823,diskett,Disketter är gammal teknik som inte används längre,diskett-01286-fras-1.mp4
1823,diskett,"Idag är disketter omodern teknik, nu för tiden använder man USB eller molnet istället. ",diskett-01286-fras-2.mp4
1826,spara,När jag var liten så brukade jag spara pengar i spargrisen. ,spara-01290-fras-1.mp4
1826,spara,Jag vill spara pengar för att ha en chans att kunna resa utomlands till sommaren. ,spara-01290-fras-2.mp4
1826,spara,Jag ska spara pengar eftersom jag vill byta till en nyare bil. ,spara-01290-fras-3.mp4
1826,spara,Min son sparar alla sina fickpengar eftersom han vill köpa lego. ,spara-01290-fras-4.mp4
1828,bete sig fånigt,Var snäll och sluta larva dig. Det här är gymnasiet och ingen lekskola.,bete-sig-fanigt-01292-fras-1.mp4
1828,bete sig fånigt,"Den där killen som bara skryter om sin flotta bil, han är bara så fånig! ",bete-sig-fanigt-01292-fras-2.mp4
1828,bete sig fånigt,Sluta fåna dig! ,bete-sig-fanigt-01292-fras-3.mp4
1828,bete sig fånigt,Jag har nyss köpt många nya parfymer för totalt 3000 kr. Lite fånigt kanske...,bete-sig-fanigt-01292-fras-4.mp4
1830,på måfå,En tipsrad fyller jag inte i med någon eftertanke. Jag kryssar bara på måfå.,pa-mafa-01294-fras-1.mp4
1835,kosta,"Jag har köpt en sommarstuga vid havet. Den var dyr. Den kostade 4,5 miljoner.",kosta-01300-fras-1.mp4
1835,kosta,Kostar kaffet åtta kronor?,kosta-01300-fras-2.mp4
1836,köpa,Jag är sugen på att köpa en ny TV.,kopa-01301-fras-1.mp4
1836,köpa,Du kan köpa en bok men du kan aldrig köpa kunskap.,kopa-01301-fras-2.mp4
1837,pengar,Jag har gott om pengar.,pengar-01302-fras-1.mp4
1837,pengar,Pengar är inte allt. Det finns saker man inte kan köpa för pengar.,pengar-01302-fras-2.mp4
1837,pengar,Har du inga pengar?,pengar-01302-fras-3.mp4
1837,pengar,"Om du har en viss summa pengar och varorna blir billigare, då kan du köpa fler varor för samma summa pengar.",pengar-01302-fras-4.mp4
1842,kontant,Jag köpte min bil kontant. ,kontant-01308-fras-1.mp4
1842,kontant,Jag vill inte ha avbetalning utan jag vill handla och  betala kontant. ,kontant-01308-fras-2.mp4
1843,bidrag,Alla har rätt att få bidrag men man måste göra en ansökan.,bidrag-01309-fras-1.mp4
1851,bakvänt,Jag satte mig på pendeln för att åka söderut men det visade sig att det rullade norrut. Jag måste ha tänkt helt fel.,bakvant-01317-fras-1.mp4
1851,bakvänt,När jag kom till Australien blev jag tvungen att tänka om ute i trafiken eftersom de har vänstertrafik där.,bakvant-01317-fras-2.mp4
1857,oförskämd,En gång när jag åkte tåg blev jag på ett ovänligt sätt tillsagd att visa biljetten. Jag tycker det var oförskämt!,oforskamd-01325-fras-1.mp4
1857,oförskämd,Om man har en sittplats på tunnelbanan bör man erbjuda sin plats när det kommer en äldre person. Annars är man oförskämd,oforskamd-01325-fras-2.mp4
1857,oförskämd," Förut hade jag en kompis som var riktigt oförskämd. Nu vill jag inte veta av honom längre.
",oforskamd-01325-fras-3.mp4
1860,dra ut på tiden,Arbetsplatsmötena brukar alltid dra ut på tiden.,dra-ut-pa-tiden-01331-fras-1.mp4
1860,dra ut på tiden,En av de saker som jag tycker mest illa om är när folk inte betalar tillbaka det de har lånat i tid.,dra-ut-pa-tiden-01331-fras-2.mp4
1860,dra ut på tiden,Jag vill inte att mötet ska dra ut på tiden eftersom jag ska hämta barnen på förskolan.,dra-ut-pa-tiden-01331-fras-3.mp4
1860,dra ut på tiden,Min kompis ville låna tio tusen kronor så jag lånade ut pengarna men nu drar hen ut på tiden med återbetalningen. Jag behöver ju pengarna!,dra-ut-pa-tiden-01331-fras-4.mp4
1867,fundera ut,Jag ska till tandläkaren klockan 12 så jag undrar hur jag ska göra med lunchen.,fundera-ut-01341-fras-1.mp4
1867,fundera ut,Senare ikväll ska jag träffa en jättesöt flicka. Jag funderar på vilket sätt jag ska närma mig henne,fundera-ut-01341-fras-2.mp4
1867,fundera ut,Jag har ett falskt id. Jag funderar på hur jag ska komma in på puben utan att bli tagen av polisen.,fundera-ut-01341-fras-3.mp4
1868,pyssla,Små barn tycker oftast om att pyssla. ,pyssla-01342-fras-1.mp4
1868,pyssla,Många pyssla julsaker innan jul. ,pyssla-01342-fras-2.mp4
1869,installera,Imorgon bitti ska det komma en elektriker till min lägenhet för att installera ett nytt el-system. ,installera-01343-fras-1.mp4
1869,installera,Jag ska installera ett nytt redigerings-program i min dator.,installera-01343-fras-2.mp4
1877,lärare,Jag vill bli lärare.,larare-01353-fras-1.mp4
1877,lärare,Vill du bli lärare?,larare-01353-fras-2.mp4
1879,pussel,Min son lägger ofta pussel. ,pussel-01355-fras-1.mp4
1879,pussel,"Det finns olika varianter av pussel, från pussel med några få bitar till pussel med flera tusen bitar. ",pussel-01355-fras-2.mp4
1881,grova skämt,Min pappa drar ofta grova skämt.,grova-skamt-01357-fras-1.mp4
1885,har inte råd,Det är många som inte har råd att köpa märkeskläder eftersom de ofta är dyra.,har-inte-rad-01361-fras-1.mp4
1885,har inte råd,Jag fick syn på en ny cykel som jag kollade in. Men när jag såg vad den kostade var den alldeles för dyr. Jag har inte råd.,har-inte-rad-01361-fras-2.mp4
1886,hålla masken,Jag har varit på flera olika pubar och lagt märke till att de flesta dörrvakterna har stenansikten.,halla-masken-01364-fras-1.mp4
1886,hålla masken,Var snäll och försök hålla masken.,halla-masken-01364-fras-2.mp4
1886,hålla masken,Det måste vara tråkigt att stå som vakt på slottet. De måste stå helt stilla utan och röra en min.,halla-masken-01364-fras-3.mp4
1886,hålla masken,När vår chef skällde ut oss satt vi alla helt tysta utan att röra en min.,halla-masken-01364-fras-4.mp4
1888,kväll,I kväll är det fotboll på TV.,kvall-01366-fras-1.mp4
1888,kväll,I går kväll var jag ute i en timme och rastade hunden.,kvall-01366-fras-2.mp4
1888,kväll,Vill du gå ut i kväll och äta middag och sedan gå på bio?,kvall-01366-fras-3.mp4
1898,dricka,Vi människor måste dricka ungefär två liter om dagen.,dricka-01377-fras-1.mp4
1898,dricka,"Vad vill du dricka? Vatten, saft eller läsk?",dricka-01377-fras-2.mp4
1898,dricka,Alla barn var väldigt törstiga och drack massor med vatten. ,dricka-01377-fras-3.mp4
1898,dricka,"Va, drack alla vatten? ",dricka-01377-fras-4.mp4
1899,supa mycket,I somras var jag i Grekland med några kompisar. Där söp vi en hel vecka i sträck.,supa-mycket-01379-fras-1.mp4
1899,supa mycket,Du söp till rejält igår. Hur mår du idag egentligen?,supa-mycket-01379-fras-2.mp4
1900,hemlig,Du vet att jag har en hemlig present till dig. Är det inte spännande?,hemlig-01380-fras-1.mp4
1904,vatten,Jag är törstig. Jag vill ha vatten.,vatten-01384-fras-1.mp4
1907,förhindrad,Jag beställde tolk till ett föräldramöte. Men dagen efter när det var dags för mötet kom det ingen tolk. Jag blev helt ställd. Hur skulle jag kunna delta i föräldramötet då?,forhindrad-01387-fras-1.mp4
1908,kvavt,Det är alltid så kvavt i min sommarstuga. Jag är tvungen att öppna fönstren.,kvavt-11509-fras-1.mp4
1908,kvavt,Jag avskyr att åka buss när den är full med folk för då är det alltid så kvavt i luften.,kvavt-11509-fras-2.mp4
1913,president,USA har haft 44 olika presidenter och det är val vart fjärde år.,president-01395-fras-1.mp4
1913,president,USA:s president ska göra ett besök i Sverige.,president-01395-fras-2.mp4
1915,chock,När jag fick höra om attentaten den elfte september blev jag chockad för jag har vänner som bor i New York.,chock-01397-fras-1.mp4
1916,vardag,"Jag har två garderober, en för vardagskläder och en för finkläder.",vardag-01398-fras-1.mp4
1918,moster,"Nästa vecka ska jag på begravning, det är min moster som har gått bort. ",moster-01400-fras-1.mp4
1918,moster,"Min moster lever fortfarande, hon är 94 år gammal. ",moster-01400-fras-2.mp4
1919,entusiastisk,Min mobil är så gammal men imorgon ska jag få en ny och det ser jag fram emot.,entusiastisk-01401-fras-1.mp4
1919,entusiastisk,"Imorgon ska jag få min lön, det ser jag verkligen fram emot.",entusiastisk-01401-fras-2.mp4
1919,entusiastisk,"Nästa vecka ska jag ha semester, det ser jag fram emot.",entusiastisk-01401-fras-3.mp4
1922,legitimation,Om du ska gå in på puben bör du ta med legitimation för de brukar vara hårda med ålderskontrollen.,legitimation-01405-fras-1.mp4
1929,söndag,Dövgudstjänsten är inte nu på söndag utan nästa söndag.,sondag-01416-fras-1.mp4
1929,söndag,Hur många söndagar är det normalt under januari månad?,sondag-01416-fras-2.mp4
1942,vrida nacken om,"Om du inte lägger av att retas nu, får du med mig att göra!",vrida-nacken-om-01429-fras-1.mp4
1942,vrida nacken om,Hon vrider nacken dig om hon får veta vad du har gjort.,vrida-nacken-om-01429-fras-2.mp4
1943,sen,Jag kommer hem sent ikväll.,sen-01432-fras-1.mp4
1944,långtradare,Långtradare brukar köras på kvällar och nätter då det är mindre trafik.,langtradare-01433-fras-1.mp4
1947,vänta bara,"Vänta bara, jag kommer att ge igen.",vanta-bara-01436-fras-1.mp4
1953,astronomi,"Jag har tre intressen; odling, schack och astronomi. ",astronomi-01443-fras-1.mp4
1953,astronomi,"Min arbetskamrat har gedigna kunskaper inom astronomi, vad man än frågar har hen alltid ett svar. ",astronomi-01443-fras-2.mp4
